{
  "schema":"rehearsal_campaign_worker_result/v1",
  "batch":{"start":351,"end":360,"source_authority":"9716fcd5ac74b71041b36a7a7735a04c71766ef3"},
  "chapters":[
    {"chapter":351,"disposition":"source_win","discoveries":["Greg's paid work increasingly depends on accurate bounded observation rather than exceptional intervention.","Competence is visible in knowing the assignment's limits."],"rejected_hot":[{"label":"pov_crowding","finding":"A larger insight would make routine professional trust feel like another protagonist revelation."}]},
    {"chapter":352,"disposition":"source_win","discoveries":["Infrastructure remains legible as maintained systems with workers, records, access rules, and uncertainty.","Magic does not need to announce itself when ordinary procedure already carries pressure."],"rejected_hot":[{"label":"overacted_theatre","finding":"Adding danger would weaken the satisfying procedural stakes."}]},
    {"chapter":353,"disposition":"source_win","discoveries":["Greg can report fatigue or access needs before failure, making self-knowledge part of professional competence rather than vulnerability theatre.","Coworkers can adjust pace without turning accommodation into a relationship speech."],"rejected_hot":[{"label":"movement_saturation","finding":"Forcing a stair failure would punish the exact competent communication the scene is establishing."}]},
    {"chapter":354,"disposition":"source_win","discoveries":["A mismatch between physical tag and paper record is allowed to remain a mismatch until the correct authority verifies it.","Greg's accurate reading matters because it prevents false clearance, not because he diagnoses the system."],"rejected_hot":[{"label":"character_caricature","finding":"Making Greg the person who identifies the wrong component would collapse the verifier chain into hero competence."}]},
    {"chapter":355,"disposition":"source_win","discoveries":["Supervisors model bounded language such as could be wrong tag, wrong list, or wrong unit, preserving multiple live explanations.","The system rewards stopping a sign-off rather than producing an answer."],"rejected_hot":[{"label":"pov_crowding","finding":"Additional speculation would undermine the procedural discipline that gives the scene tension."}]},
    {"chapter":356,"disposition":"source_win","discoveries":["Greg's economic progression is tied to completed, scoped labor and actual payment rather than abstract leveling.","He increasingly does not ask what everyone else earns, a small but meaningful reduction in compulsive accounting."],"rejected_hot":[{"label":"overcompression","finding":"The mundane sign-off and payment sequence is the payoff for the chapter's work contract."}]},
    {"chapter":357,"disposition":"source_win","discoveries":["Professional relationships can deepen through repeat reliability without needing friendship labels.","Future work remains contingent rather than promised destiny."],"rejected_hot":[{"label":"overacted_theatre","finding":"A warmer recruitment beat would overstate a relationship that currently works because it is procedural."}]},
    {"chapter":358,"disposition":"source_win","discoveries":["Greg's first-life knowledge continues to function best as category recognition that must survive current-world verification.","Confidence now triggers caution more often than performance."],"rejected_hot":[{"label":"character_caricature","finding":"Turning memory recognition into secret mastery would reverse the epistemic growth of this entire stretch."}]},
    {"chapter":359,"disposition":"source_win","discoveries":["The manuscript keeps ordinary infrastructure, work, money, and magic braided together without forcing every strand into one plot mechanism.","Distributed authority makes the world feel inhabited rather than staged for Greg."],"rejected_hot":[{"label":"pov_crowding","finding":"A unifying Greg theory would make independent systems feel artificially connected."}]},
    {"chapter":360,"disposition":"source_win","discoveries":["Saret and Greg divide verification cleanly: Greg reads physical reality, Saret reads the list, Pell owns route status and follow-up.","The D-six versus D-eight mismatch demonstrates the mature story rule that accurate observation can matter enormously without granting diagnostic or repair authority."],"rejected_hot":[{"label":"overcompression","finding":"The repeated full-tag reads and sign-off language are functional procedural rhythm, not redundant exposition."}]}
  ],
  "candidates":[]
}
